{"$schema":"https://json-schema.org/draft/2020-12/schema","$id":"https://github.com/matrakalaka/codex-project-bootstrap/contracts/result_packet.v0.schema.json","title":"Result Packet v0","type":"object","additionalProperties":false,"required":["schema_version","result_id","correlation_id","task_id","repoguard_session_id","outcome","repository","changed_paths","verification","evidence","unresolved_risks","human_action_required","next_action","stop_reason","created_at"],"properties":{"schema_version":{"const":"result_packet.v0"},"result_id":{"type":"string","minLength":1},"correlation_id":{"type":"string","minLength":1},"task_id":{"type":"string","minLength":1},"repoguard_session_id":{"type":"string","minLength":1},"outcome":{"type":"string","enum":["PASS","BLOCKED_PRECONDITION","FAILED_AFTER_EXECUTION","DIVERGENCE"]},"repository":{"type":"object","additionalProperties":false,"required":["identity","starting_head","ending_head"],"properties":{"identity":{"type":"string","minLength":1},"starting_head":{"type":["string","null"]},"ending_head":{"type":["string","null"]}}},"changed_paths":{"type":"array","items":{"type":"string"}},"verification":{"type":"object","additionalProperties":false,"required":["performed","result","checks"],"properties":{"performed":{"type":"boolean"},"result":{"type":"string","minLength":1},"checks":{"type":"array","items":{"type":"object"}}}},"evidence":{"type":"object","additionalProperties":false,"required":["receipt_id","reference","integrity"],"properties":{"receipt_id":{"type":"string","minLength":1},"reference":{"type":"string","minLength":1},"integrity":{"type":"string","minLength":1}}},"unresolved_risks":{"type":"array","items":{"type":"string"}},"human_action_required":{"type":"boolean"},"next_action":{"type":"string","minLength":1},"stop_reason":{"type":"string","minLength":1},"created_at":{"type":"string","minLength":1},"playbook":{"type":"object","additionalProperties":false,"required":["id","version","fingerprint"],"properties":{"id":{"type":"string","minLength":1},"version":{"type":"string","minLength":1},"fingerprint":{"type":"string","pattern":"^sha256:[0-9a-f]{64}$"}}}}}
