{"schema_version":"result_packet.v0","result_id":"result-divergence","correlation_id":"corr-1","task_id":"task-1","repoguard_session_id":"session-1","outcome":"DIVERGENCE","repository":{"identity":"https://example.invalid/repo.git","starting_head":"aaaaaaaaaaaaaaaaaaaaaaaaaaaaaaaaaaaaaaaa","ending_head":"bbbbbbbbbbbbbbbbbbbbbbbbbbbbbbbbbbbbbbbb"},"changed_paths":["secrets/key"],"verification":{"performed":true,"result":"DIVERGENCE","checks":[]},"evidence":{"receipt_id":"receipt-1","reference":"session-1","integrity":"VALID"},"unresolved_risks":["forbidden path"],"human_action_required":true,"next_action":"STOP","stop_reason":"PROTECTED_BOUNDARY_CROSSED","created_at":"2026-09-17T00:00:00Z"}
