{"schema_version":"result_packet.v0","result_id":"result-blocked","correlation_id":"corr-1","task_id":"task-1","repoguard_session_id":"session-1","outcome":"BLOCKED_PRECONDITION","repository":{"identity":"https://example.invalid/repo.git","starting_head":null,"ending_head":null},"changed_paths":[],"verification":{"performed":false,"result":"NOT_RUN","checks":[]},"evidence":{"receipt_id":"receipt-1","reference":"session-1","integrity":"VALID"},"unresolved_risks":["approval missing"],"human_action_required":true,"next_action":"REVIEW","stop_reason":"ADMISSION_BLOCKED","created_at":"2026-09-17T00:00:00Z"}
